{"artifacts":[{"bytes":426,"path":"datasets-sidecar.json","retention":"essential_evidence","sha256":"9aaee87918916512a25a489914f91dd3d8089fc2b1fa694cd1efb27c074b578c"},{"bytes":304,"path":"low-dependence-candidate-suite.json","retention":"essential_evidence","sha256":"5de46a77557012540698d615fde7444b64cc7f77efa4517c0ba581d6b7965ea8"},{"bytes":73221,"path":"perten-admission.json","retention":"essential_evidence","sha256":"b5e7c0a56bd9d46d39c2de18b0ad13d29fef1d7e6098e604018040a0bdce20dc"},{"bytes":1252,"path":"perten-comparison-suite.json","retention":"essential_evidence","sha256":"3097a6bb69fee4f5eae1f86971785d39ae090dd0c2faff9200b81d2c14878b36"},{"bytes":2138,"path":"perten-comparison-uncertainty.json","retention":"essential_evidence","sha256":"d728820293797e091e3477f94e4216ec1b564a05e48bd457f2490bd75989a5e2"},{"bytes":1299967,"path":"perten-evidence.json","retention":"essential_evidence","sha256":"faea59056157e1022571eb5c011ca30ebbc96a5bc1bd62fb3b1318e718cf73ea"},{"bytes":235031,"path":"perten-family-comparison.json","retention":"essential_evidence","sha256":"52bda07d41ce8cc22b0c933b64aadf8e82396e64955a77f447dfdab2ec236c39"},{"bytes":3384,"path":"perten-intrinsic-and-geometry.json","retention":"essential_evidence","sha256":"37d5bd26fd9e72542e8776f180e470bdd53a1c6351bf967a0446c620c572c265"},{"bytes":217,"path":"perten-replay.json","retention":"essential_evidence","sha256":"a1d32122470ce1ff086a390015ed5ae4552a9ce1510f40365f24d33d3727551e"},{"bytes":596,"path":"perten-task.json","retention":"essential_evidence","sha256":"9218790686b5cbb611e75e9efff7188e9c951c938d902d47093e6368b5fb39c4"},{"bytes":1127,"path":"structure-challenge-suite.json","retention":"essential_evidence","sha256":"fa4b6431d0dc4d6c12789fed8282eba5b1a1fea90e437368f20be6f5c073039d"}],"cache_dependencies":[{"access":"public","bytes":448,"content_sha256":"f44fda331cddad5b8e527cc0a70d4138af25613d111ceff746c44abfbc994180","local_locator_key":"perten_canonical_canonical_dataset_json","provider":"Datasets 0.3.11 local canonical reproduction"},{"access":"public","bytes":338592,"content_sha256":"414ba8aab02298ffc6f33bc4f83934d9a65804a2d278b202a63abd2294967154","local_locator_key":"perten_canonical_canonical_sources_X_parquet","provider":"Datasets 0.3.11 local canonical reproduction"},{"access":"public","bytes":14684,"content_sha256":"84d1798fc03aa60023c2bff6f7f152c61fb933f3e7c59f05df3ffbcf3afc91ea","local_locator_key":"perten_canonical_canonical_variables_parquet","provider":"Datasets 0.3.11 local canonical reproduction"},{"access":"public","bytes":1633372,"content_sha256":"760bfa135ac94d0e76d905a65ee9b65813c07116e7da1e1ff10d0af3cd82f5fc","local_locator_key":"perten_original_task","provider":"Domains audited keyed scratch input"},{"access":"public","bytes":2692791,"content_sha256":"f541c62dbb7d4fbc7e30e145c087eb97e2039b6a82d4d3d29f8ba399060462c4","local_locator_key":"frozen_ecosis_alpha8_evidence","provider":"Frozen repository alpha.8 evidence for the two-task suite"}],"execution_id":"6fdc0f22c60d636f5362377b8ce9cd97668ee59b0c3bcde6e9e0bf4e19203a9c","limitations":["Exact representative PLS fold replay; complete historical campaign replay is not claimed.","Authorized cache resolution and matching Domains/Methods/DAG/controller builds remain required.","CORN remains pending by the owner's explicit decision: no rights justification; original keys also absent."],"measured_bytes":1617663,"optional_archives":[],"protocol_version":"domains.storage.v0.1","replay_grade":"reconstructed_from_cache","schema_version":1}
