{"artifacts":[{"bytes":2692791,"path":"ecosis-evidence.json","retention":"essential_evidence","sha256":"f541c62dbb7d4fbc7e30e145c087eb97e2039b6a82d4d3d29f8ba399060462c4"},{"bytes":634,"path":"ecosis-task.json","retention":"essential_evidence","sha256":"e85a4eb0650f3e366e6fc33824b9e074d30f20de9c76044af8378503f8fee47a"},{"bytes":382,"path":"low-dependence-candidate-suite.json","retention":"essential_evidence","sha256":"3ae0e15a1227bae39b693afe839f7559bf0b44f952498f3816ee3fd9689a617d"},{"bytes":720754,"path":"mixed-control-evidence.json","retention":"essential_evidence","sha256":"2870868c54305b3b8bc07d892a4b176fed744993e97dabec208247382e86fc35"},{"bytes":922,"path":"structure-challenge-suite.json","retention":"essential_evidence","sha256":"ca5854c04dc97d48635b13bd371bfc1d2a102f528f44e556f3f56fd2cce84889"}],"cache_dependencies":[{"access":"public","bytes":3702896,"content_sha256":"724126885a933bde6dda087d6f27ac14d2f0150641861299a603ee8583931db3","local_locator_key":"ecosis_alpha6_mean_task","provider":"Datasets0.3.11 historical local canonical reproduction + audited mean export"},{"access":"requires_authorization","bytes":137560715,"content_sha256":"36204d732780f16ae5eb7e26dc97820d5a05276bda1a93b6994cd17f3315c591","local_locator_key":"ecosis_alpha7_full_report","provider":"Frozen Domains alpha7 report"},{"access":"requires_authorization","bytes":63912,"content_sha256":"f29f2ebf14c80dcafb55fead61ade496cc521ffdd9db9de7ad25df2aec5a6eef","local_locator_key":"alpha8_control_controller_wheel","provider":"Domains alpha8 qualified synthetic controller wheel (before later cleanup-plan hardening)"}],"execution_id":"e3227e0753e66ce205b2afd0ae90e11716197551d6ffde2289c0e90b40d61c4d","limitations":["Two representative cells exactly replayed; not all old attempts rerun.","Replay needs preserved local bytes plus matching Methods binary and controller; historical transport-binary identity is incomplete.","Synthetic frozen evidence pins an earlier controller digest; the matching wheel remains in the authorized local cache. Current cleanup-plan hardening is separately tested."],"measured_bytes":3415483,"optional_archives":[],"protocol_version":"domains.storage.v0.1","replay_grade":"reconstructed_from_cache","schema_version":1}
