{"artifacts":[{"bytes":4472,"path":"anchors-replay.json","retention":"essential_evidence","sha256":"4142257af5ece3ffd1a89f0d27f57b2918afced17e012529653998a1113e2364"},{"bytes":250808,"path":"cartilage-admission.json","retention":"essential_evidence","sha256":"52a0ac8b921c13c08a00ab989e5b7d431afc09e6ae4b1565b0d4fc24f83219a6"},{"bytes":539,"path":"datasets-sidecar.json","retention":"essential_evidence","sha256":"e341b7aa5a6e070fba5756e09e4fc0d0bd9db602d4584dddc4181195b0599d83"},{"bytes":176,"path":"fast_hard_v1-replay.json","retention":"essential_evidence","sha256":"49438022c1052bd7b349afdb9a7ff1c06f349bfb76dc6962f3e9997ab1004e66"},{"bytes":391186,"path":"fast_hard_v1.json","retention":"essential_evidence","sha256":"92b22677f15bf50d7fdf99d8589264585a8fe4fb7634bb5b358c070eff56b705"},{"bytes":289107,"path":"fast_sparse_v1.json","retention":"essential_evidence","sha256":"dbb8f8c93cc0eaecbdc8e984e52fcd0ec5519b1c6638cca687c34154a672e673"},{"bytes":540,"path":"low-dependence-candidate-suite.json","retention":"essential_evidence","sha256":"375f7e87fcdd1b43ae28b9ebf0e9b708669f1dd3c1756565a4c3553b4669fcf9"},{"bytes":3494,"path":"paired-admission.json","retention":"essential_evidence","sha256":"849587dc6bd7b2ed84bbf0b5dd8b857bbb1a0dca6d07a0ac0f25d230320a1c8d"},{"bytes":549423,"path":"perten-evaluation.json","retention":"essential_evidence","sha256":"a99f2a51781480cb1376974b8b4c34d6d3b18d61f92baff63a042677a40a4653"},{"bytes":6484,"path":"perten-evidence.json","retention":"essential_evidence","sha256":"93e6ef0704fff8d8faaeaf829394e0499c4594e97f8b627148344f8311bd5a63"},{"bytes":1040,"path":"perten-reference-review.json","retention":"essential_evidence","sha256":"b4ab9a9750f4083a9d4907931ddd341717c7a8b74282b3648e0b0997dc258176"},{"bytes":55488,"path":"perten-summary.json","retention":"essential_evidence","sha256":"54b435a58a8d0757ce78054fad0e4eea4653e2ccb0f177f4331fc450a4cb3163"},{"bytes":239850,"path":"pls_snv_v1.json","retention":"essential_evidence","sha256":"f720fad299df062baf37eb7cdee28b66fe5e873b3fe6bdd7f9aa8b3f6a5d42b5"},{"bytes":169,"path":"ridge_tuned_v1-replay.json","retention":"essential_evidence","sha256":"0831a271d8b0e53c678b09d725616ec14a141f3862ffb3d2718868aa5598f790"},{"bytes":239410,"path":"ridge_tuned_v1.json","retention":"essential_evidence","sha256":"2cc5830c633df110ee58b91e3ddb84d81367742844590892b2624c01ed6344aa"},{"bytes":245909,"path":"size-control-evaluation.json","retention":"essential_evidence","sha256":"75f2250b771a593ac0b0b73a4b96ed0d81a8625324ebb5874f6d70c69ac5bbd8"},{"bytes":418636,"path":"size-control-results.json","retention":"essential_evidence","sha256":"cb5a272f99b8619b99cd58966c907946bdf1d9826f79916b7d2f7620e58d6061"},{"bytes":1244,"path":"structure-challenge-suite.json","retention":"essential_evidence","sha256":"fa17ee2db620acfe7fe412827c3a7192e0a9f6c31324c38bd39ea82b2e5abe77"},{"bytes":523,"path":"transfer-suite.json","retention":"essential_evidence","sha256":"7cb5db2f934b96c5340222748abe0944036907ee2a8d4e5e47c1ba9e91149e0c"},{"bytes":913,"path":"within-population-suite.json","retention":"essential_evidence","sha256":"911bcb136d98f10371e83e9cbd6e9a057c490a1a5af38ceb5af1b7cc531f00fe"}],"cache_dependencies":[{"access":"public","bytes":1997589,"content_sha256":"c639675612bb3e6ac78c6c6dfd623cc1c35d9ca23d83744167db684467fa62a2","local_locator_key":"perten-alpha9-mean-task","provider":"Frozen alpha.9 Perten admitted input"}],"execution_id":"f2223f706ade18e9a0182c397212a240d7efc0762f23634eb9c6b24994fb3294","limitations":["Models require pinned upstream providers/source and authorized original data; compact evidence contains no X or serialized models.","Native exact anchor replay and adaptive tolerance replay have different contracts."],"measured_bytes":2699411,"optional_archives":[],"protocol_version":"domains.storage.v0.1","replay_grade":"reconstructed_from_cache","schema_version":1}
